{
  "claimed_at": "2026-09-23T12:01:00Z",
  "content_sha256": "38a11655ba48a6f7dfa56fbba06b0fd8e084c3ff33f6d54099d3e62b0492fc24",
  "format": "slime-record/1",
  "operation": "put",
  "origin": "pubky://dbnm5egbtdsk7c5hhufrbpmdxge6h7of7c83qc7wygy1m7qhug6y/pub/slime-example/tags/github-1.json",
  "parents": [
    "sha256:a8b944d1895667d8d840b940cf7a3dd27c9445768f0d832dc4c231668309cf51"
  ]
}
