{
  "claimed_at": "2026-09-23T12:00:00Z",
  "content_sha256": "99a2e249dcf6baf80b8deefe07a0851f54463b0bda5e13a0e09d5cb398d1e640",
  "format": "slime-record/1",
  "operation": "put",
  "origin": "pubky://kq47ts1oghjief4acyjc7q8nuut5iodyw48atubb5d9h1gmoz1no/pub/slime-example/listings/shirt-1.json",
  "parents": []
}
