{
  "claimed_at": "2026-09-23T12:03:00Z",
  "content_sha256": null,
  "format": "slime-record/1",
  "operation": "delete",
  "origin": "pubky://dbnm5egbtdsk7c5hhufrbpmdxge6h7of7c83qc7wygy1m7qhug6y/pub/slime-example/tags/github-1.json",
  "parents": [
    "sha256:f9151b27f4c45a3ff208285676034610803ff584f21de6193c914d0f876ca2f5"
  ]
}
