{
  "claimed_at": "2026-09-23T12:02:00Z",
  "content_sha256": "228cbafbd3508bfb8a63841e4334e9bcc1a8df1e59bb5611166768a5c0443515",
  "format": "slime-record/1",
  "operation": "put",
  "origin": "pubky://dbnm5egbtdsk7c5hhufrbpmdxge6h7of7c83qc7wygy1m7qhug6y/pub/slime-example/tags/github-1.json",
  "parents": [
    "sha256:a8b944d1895667d8d840b940cf7a3dd27c9445768f0d832dc4c231668309cf51"
  ]
}
